candidate_relation_triple,label
spring mvc stands for model view controller,1
kotlin combines oop,1
kotlin is focused on tooling support,1
kotlin is focused on interoperability,1
kotlin is focused on safety,1
kotlin is focused on clarity,1
kotlin targets the jvm,1
kotlin targets javascript,1
kotlin supports jvm bytecode,1
kotlin supports javascript,1
kotlin supports native code,1
sql server aims to make tuning,1
sql server aims to make self organizing,1
geography uses an ellipsoidal model,1
sql server includes compression features,1
sql server enhanced the indexing algorithms,1
sql server includes resource governor,1
resource governor allows reserving workflows,1
resource governor allows reserving certain users,1
sql server includes capabilities,1
sql server supports data definition,1
sql server supports the ado.net entity framework,1
sql server supports the reporting tools,1
sql server supports replication,1
dundas data visualization was acquired by microsoft,1
sql server reporting services includes the declarative management framework,1
the declarative management framework allows configuring configuring policies,1
the declarative management framework allows configuring constraints,1
sql server reporting services includes the management side,1
the declarative management framework allows configuring the entire database,1
the declarative management framework allows configuring certain tables,1
the iso standard is withdrawn from the iso website,1
database development tool combines ace database engine,1
database development tool combines a graphical user interface,1
database development tool uses ace database engine,1
database development tool uses the jet,1
an open source project enables modular program construction,1
jsp supports taglibs,1
taglibs are backed by pieces,1
jsp supports expression language,1
jsp runs in producing html output,1
jsp runs in the web server,1
jsp don't run in sync,1
javascript don't run in sync,1
jsp has been succeeded by java ee,1
jsp has been succeeded by facelets,1
jsp is not treated in the java ee 6 tutorial,1
the listview control is used extensively in the windows ui shell,1
the listview control providing the display surface,1
the listview control is provided by the common controls library,1
the listview control can be used by any application,1
gtk are implemented as columnar treeview,1
a pointer variable contains a memory address,1
pointers have performance benefits,1
windows communication foundation is designed using architecture principles,1
services have a wsdl interface,1
windows communication foundation implements many advanced web services,1
framework provides routing,1
framework provides rss syndication services,1
an endpoint has an address,1
the endpoint can be accessed binding properties,1
batch files are still supported under windows,1
authentication is different than authorization,1
authentication allow access,1
authentication happen together to verify identity,1
authorization happen together to verify identity,1
each authentication factor covers elements,1
elasticsearch is often combined with logstash,1
elasticsearch is often combined with kibana,1
stack has now been renamed elastic stack,1
elasticsearch comes with preprocessing algorithms,1
official clients are available in ruby,1
official clients are available in java,1
official clients are available in javascript,1
official clients are available in c#,1
official clients are available in php,1
official clients are available in python,1
templates allow for generic programming,1
the c++ book guide contains books treating templates,1
variables are constrained by languages,1
variables are constrained by a specific data type,1
data types share many commonalities,1
data types may vary across languages,1
composite data types consist of other composite types,1
composite data types consist of the primitive types,1
the specifics vary programming languages,1
the specifics vary implementations,1
the specifics vary programming languages,1
the specifics vary implementations,1
dart compiles to modern javascript,1
dart provides tools,1
delphi originated in borland,1
delphi is currently owned by embarcadero,1
delphi prism is mostly compatible with delphi syntax,1
breakpoints can display a message containing program information,1
breakpoints can be created using a debugging tool,1
breakpoints can be created using simple form,1
visual studio comes with partial c++11 support,1
nginx is known for low resource consumption,1
nginx is known for high performance,1
nginx is known for stability,1
nginx is known for rich feature set,1
nginx is known for simple configuration,1
haskell allows rapid development,1
char8 module can be used for instance,1
char8 module can be used for an efficient representation,1
ssl is used as a blanket term,1
ssl refers to the transport layer security,1
netscape communication corp pioneered primitive security protocol,1
netscape communication corp pioneered ssl,1
the http protocol running over tls,1
iso is important as a reference,1
iso is not exactly written for pdf beginners,1
letters can be encoded as raster images,1
letters can be encoded as line art,1
letters can be encoded as vector graphics,1
letters can be encoded as font glyphs,1
a pdf files contain drawing drawing instructions,1
machine learning revolves around developing learning computer algorithms,1
machine learning explores the construction,1
machine learning explores study,1
xamarin is headquartered in an engineering office,1
xamarin is headquartered in san francisco,1
xamarin was acquired by microsoft,1
the xamarin platform includes visual studio,1
xamarin created the xamarin platform,1
the xamarin platform includes xamarin.ios,1
xamarin introduced build host,1
build host provides the connection,1
build host enhances access,1
jpa is now considered the standard industry approach,1
jpa includes several improvements,1
purpose os was developed by the late 1960s,1
purpose os was developed by bell labs,1
unix was developed as house operating system,1
the free unix clone linux would rise in the 1990s,1
the unix lacks the trademark,1
mac os x. support the standardized x window system,1
flask has exceptional documentation,1
flask has a large number,1
flask has a friendly community,1
jobs can be run across multiple machines,1
jobs can be run across cross-platform software,1
jenkins set a new build slave,1
jenkins set accessible machine,1
jenkins supports a long list,1
jenkins support different source control systems,1
fragments represent reusable behaviors,1
fragments represent portions,1
fragments represent an android app,1
a fragment represents a behavior,1
a fragment represents a portion,1
fragments were first introduced in android,1
the apidemos sample application present provides runnable fragment examples,1
github offers all of revision control,1
github offers all of source code management,1
github provides graphical interface,1
github provides desktop,1
github provides access control,1
github provides collaboration,1
github offers plans,1
github reports having 100 million repositories,1
github reports having 40 million users,1
selenium webdriver provides the webdriver api,1
selenium webdriver provides controlling browsers,1
selenium webdriver focuses mostly on user interaction,1
selenium webdriver does allow direct javascript interaction,1
hadoop refers to file system,1
one name node will accept the requests,1
one name node use some data nodes,1
lots will share the processing work,1
lots will share some data nodes,1
one name node do some processing,1
one name node use some data nodes,1
hadoop works with other filesystems,1
hadoop disposes of a standalone resource manager,1
a session refers to the communication,1
a session is specific to the user,1
a new session is created to track each user,1
a new session is created to track the requests,1
a session is set a certain point,1
a session is set time,1
a session torn a later point,1
a session torn time,1
communication session may involve one message,1
the communication consists of independent requests,1
the communicating parts needs to save information,1
any unidirectional transmission does not define a session,1
a technology connects various kinds,1
a technology connects hypertext documents,1
timbl proposed the idea,1
wide web was tim berners known as timbl,1
web pages may contain text,1
web pages may contain images,1
web pages may contain videos,1
web pages may contain other multimedia,1
ionic framework has used apache cordova,1
the ionic team are also developing capacitor,1
web apps run natively on ios,1
web apps run natively on android,1
web apps run natively on electron,1
web apps run natively on the web,1
automation tool uses a groovy dsl,1
actionscript is widely used for desktop applications,1
actionscript is widely used for rias,1
actionscript is widely used for mobile apps,1
actionscript can be used to create web programs,1
the java servlet are developed under the java community process,1
jsp are developed under the java community process,1
java api are developed under the java community process,1
apache tomcat is developed in participatory environment,1
animation can be made with dimensional objects,1
animation can be made with art,1
animation can be made with imagery,1
ggplot2 replaces basic plot,1
ggplot2 replaces the lattice package,1
ggplot2 replaces r's graphics,1
ggplot2 replaces the lattice packages,1
amazon provides storage,1
amazon provides a simple web services interface,1
amazon s3 gives any developer access,1
amazon uses to run inexpensive infrastructure,1
amazon uses to run own global network,1
the curl project produces two products,1
the curl project produces libcurl,1
the curl project consists of a c library,1
the curl project consists of line tool,1
libcurl has bindings,1
heroku features a large number,1
heroku features api deployment strategies,1
heroku features a full api,1
heroku dev center contains official guides,1
heroku allows safety,1
heroku allows portability,1
heroku manage specific configuration,1
heroku uses the plugin system,1
heroku has provided some gems,1
the cocoa frameworks consist of libraries,1
the cocoa frameworks consist of apis,1
internet explorer uses the trident rendering engine,1
internet explorer uses the chakra javascript engine,1
internet explorer mobile is based on internet explorer,1
internet explorer mobile made for ce,1
internet explorer internet explorer is assigned ms,1
internet explorer internet explorer is assigned the w3c,1
tkinter runs on operating systems,1
tkinter is based the toolkit,1
tk provides a native look,1
tkinter are included with all standard python distributions,1
tkinter has dialogues,1
dialogues can be used for interactive dialogues,1
interactive dialogues can be accessed by python,1
interactive dialogues can be accessed by import tkinter.simpledialog,1
interactive dialogues can be accessed by python,1
interactive dialogues can be accessed by import tksimpledialog,1
exceptions invoking a handler block,1
exceptions invoking routine,1
exception will propagate the stack,1
unhandled exceptions lead to abnormal termination,1
software errors generate exceptions,1
a class sub inherits from another class,1
a class sub inherits from other object,1
math involves the manipulation,1
mathematicians seek patterns,1
mathematicians establish truth,1
mathematicians establish rigorous deduction,1
mathematics evolved from measurement,1
mathematics evolved from the use,1
mathematics evolved from the systematic study,1
mathematics evolved from counting,1
mathematics evolved from calculation,1
the svg format differs from raster formats,1
svg can be embedded within html using html parsing rules,1
the windows api was formerly called the win32 api,1
bit windows programs interact with the windows api,1
the windows api is primarily focused on the c programming language,1
the windows api exposed data structures,1
the windows api may be used by assembler,1
the windows api may be used by any programming language compiler,1
npm can be used to install ecmascript modules,1
npm can be used to install commonjs,1
npm can be used to install ecmascript modules,1
npm packages manage dependencies,1
npm packages pass information,1
npm packages pass the package.json file,1
the package.json file contains entries,1
idiom uses xml configuration files,1
idiom uses the mvc pattern,1
merchants need an online presence,1
bespoke storefront does not suit budget,1
magento is aimed at merchants,1
magento configuration can be performed by minimal technical background,1
magento offers extensive customization,1
magento offers a developer certification program,1
the mvc pattern is supported by factory methods,1
magento data are based on value model,1
magento offers warranties,1
magento offers indemnification,1
magento provides warranty,1
magento provides indemnification,1
magento has benefit,1
image processing techniques applying standard signal processing techniques,1
the document object model defines the logical structure,1
xml may represent the dom,1
xml may represent a string,1
the dom was limited in the distant past,1
image elements could be referenced with a hierarchical name,1
a hierarchical name began with the root document object,1
laravel uses components,1
laravel uses technics,1
laravel utilises composer,1
mongoose written in javascript,1
mongoose written in javascript,1
mozilla firefox implements many web standards,1
mozilla firefox implements apng,1
mozilla firefox runs on various operating systems including windows,1
mozilla firefox runs on various operating systems including windows,1
mozilla firefox source code is licensed under the mozilla public license,1
intellij idea is often simply referred to as idea,1
intellij idea is often simply referred to as intellij,1
kubernetes can run on various cloud providers,1
kubernetes can run on premises,1
kubernetes can run on bare metal machines,1
kubernetes can run on various cloud providers,1
kubernetes can run on premises,1
kubernetes can run on bare metal machines,1
gcc includes an optimizing c compiler,1
gcc includes c,1
gcc includes front ends,1
gcc includes fortran,1
gcc includes ada,1
gcc includes libraries,1
syslog was created solely for sendmail,1
matrices can be added element,1
matrices can be added element,1
screen involves the programmatic collection,1
opengl gives greatly improved performance,1
opengl is designed to provide rendering,1
opengl es have es,1
opengl es have webgl,1
webgl have es,1
webgl have webgl,1
khronos group announced vulkan api,1
vulkan is widely thought of as the successor,1
iis stands for internet information services,1
iis can be used for problems,1
iis be used for programming problems,1
xml files can be used relational database tables,1
xml files can be used geographical information systems,1
xslt syntax is based on xml,1
xslt borrows functional languages,1
xsl is written in an xml format,1
xslt was proposed by the w3c,1
adobe flash has reached the eol,1
adobe flash has reached flash content,1
adobe has been available for 2.2 mobile devices,1
flash updated by adobe,1
the javafx platform is built on java technology,1
javafx is shipped as a library,1
xpath operates on logical structure,1
xpath uses non-xml syntax,1
xpath operates on logical structure,1
xpath gets xpath name,1
xpath gets xpath use,1
xpath gets urls,1
xpath is now used in xslt,1
xpath is now used in xpointer,1
xpath is now used in other host languages,1
keras is also integrated in the tensorflow framework,1
keras be used from tensorflow,1
web api was created by the microsoft,1
json database provides offline caching synchronization,1
apple running the ios operating system,1
ipad applications are usually written in c,1
ipad applications are usually written in swift,1
ipad applications are usually written in the xcode ide,1
apple running the ios operating system,1
ipad applications are usually written in c,1
ipad applications are usually written in the xcode ide,1
facebook graph api is provided by the facebook platform,1
encryption been used by militaries,1
encryption been used by governments,1
encryption has long been used militaries,1
encryption has long been used governments,1
encryption facilitate secret communication,1
encryption facilitate secret communication,1
encryption is now commonly used in protecting protecting information,1
encryption is also used to protect data,1
encryption can protect the confidentiality,1
the canvas is commonly used to display drawings,1
the canvas draw pixel data,1
visual studio code includes rich development experiences,1
visual studio code includes git control,1
visual studio code includes various extensions,1
visual studio code is available for linux,1
visual studio code is available for windows,1
visual studio code is available for mac,1
visual studio code has a rich ecosystem,1
visual studio code uses the blink layout engine,1
the visual studio code team provides keymaps,1
the visual studio code team provides popular editors,1
jstl doesn't support servlet container,1
core is supported by microsoft,1
library provides level interface,1
gnuplot works for mac,1
gnuplot works for windows,1
gnuplot works for linux,1
gnuplot works for other operating systems,1
arraylist denotes an abstract data type,1
arraylist represents the list contents,1
mod_rewrite can provide conditional hooks,1
mod_rewrite can provide functionality,1
mod_rewrite can be used to perform external redirects,1
the applicable c++ standard library container class is called std,1
cakephp uses commonly known design patterns,1
cakephp uses commonly known the convention,1
cakephp uses design patterns,1
cakephp uses configuration,1
cakephp uses convention,1
cakephp comes with form tampering protection,1
cakephp comes with injection prevention,1
cakephp comes with tools,1
cakephp comes with input validation,1
cakephp comes with xss prevention,1
cakephp comes with csrf protection,1
amazon ec2 rent virtual machine instances,1
amazon ec2 rent virtual machine instances,1
razor supports seamless transitions,1
razor supports seamless transitions,1
jdbc is oriented towards relational databases,1
intents are used extensively within the android platform,1
microsoft visual c++ supports debugging raw assembly code,1
microsoft visual c++ supports debugging a native code,1
microsoft visual c++ allows multiple processes,1
grails has a plugin architecture,1
a plugin architecture can provide common web application,1
google cloud platform provides store data,1
google cloud platform provides cloud computing services,1
google cloud platform provides store data,1
java ee specifies client architectures,1
java ee uses profiles,1
java ee define technology sets,1
java ee is currently migrating to level project ee4j,1
java ee is currently migrating to the intent,1
java ee is currently migrating to the eclipse foundation,1
java ee has been rebranded as open community process,1
java ee has been rebranded as jakarta ee,1
redux serves as a centralized store,1
dijkstra's algorithm runs in quadratic time,1
dijkstra's algorithm can be shown to run a fast fibonacci heap,1
meteor is built on one unifying idea,1
npm became fully supported meteor,1
xcode provides an object model editor,1
woocommerce is built in jquery,1
woocommerce is built in php,1
woocommerce is built in mysql,1
woocommerce is built in javascript,1
woocommerce is now owned by woocommerce parent company automattic,1
viewmodel is used in frameworks including wpf,1
viewmodel is used in all xaml,1
virtual machine can be used as a scripting language,1
vim allows high efficiency,1
vim has a steep learning curve,1
vim allows many text editing tasks,1
vim is available on a large number,1
vim is often called programmer's editor,1
vim is perfect for all kinds,1
vim is perfect for composing email,1
cloud firestore is integrated into both firebase,1
cloud firestore is integrated into google cloud platform,1
lambda expressions are supported in java,1
android does not currently use java,1
the mysqli php extension provides level mapping,1
the mysqli php extension provides mysql's c interface,1
the mysqli php extension was deprecated in php version,1
mysqli features provide an equivalent procedural interface,1
mysqli features provide interface,1
beautiful soup can use standard html parser,1
beautiful soup can use other parsers,1
beautiful soup provides idiomatic ways,1
beautiful soup works only on python 2.x,1
spring security can be used to secure urls,1
spring security can be used to secure method invocations,1
spring security is widely used to secure rest applications,1
spring security is widely used to secure standalone web applications,1
spring security is widely used to secure portlets,1
spring security is released under an apache 2.0 license,1
dlls can contain code,1
dlls can contain data,1
dlls can contain resources,1
dlls can contain exes,1
netbeans refers to an integrated development environment,1
netbeans refers to a platform framework,1
netbeans ide provides multiple project windows,1
the netbeans gui builder has been used to prototype guis,1
the netbeans gui builder has been used to customer presentations,1
the netbeans gui builder provides static analysis tools,1
netbeans ide includes a visual debugger,1
netbeans ide has editors,1
netbeans ide can be installed on all operating systems,1
netbeans ide is written in java,1
the highcharts library works in all modern browsers,1
apache kafka apache kafka is used for building time data pipelines,1
apache kafka apache kafka is used for building streaming apps,1
apache kafka grants access,1
the microsoft supplied command line interpreter supplied all microsoft windows operating systems,1
pdo works with database systems,1
pdo provides access abstraction layer,1
pdo does not provide a database abstraction,1
pdo doesn't rewrite sql,1
pdo emulate missing missing features,1
pdo uses a dsn,1
pdo define the connection,1
pdo has connection options,1
connection options can help tune,1
a custom exception handler is recommended to use unhandled exceptions,1
pdo has handy methods,1
the websockets protocol described in rfc,1
the websockets api has full browser support,1
encrypted connections use url scheme,1
python provides data analysis,1
python provides data mining,1
semi-permanent data operate under databases,1
that distinct doesn't have valid applications,1
a union concatenates congruent data sets,1
ffmpeg is published under the gnu lesser general public license,1
the eloquent orm included with laravel,1
the eloquent orm provides simple activerecord implementation,1
the eloquent orm included with laravel,1
the eloquent orm provides simple activerecord implementation,1
c++ container framework provides vectors,1
maps may have multiple keys,1
java collections framework provides hash tables,1
java collections framework provides stacks,1
java collections framework provides sets,1
java collections framework provides queues,1
java collections framework provides lists,1
java collections framework provides hash tables,1
collections work with multiple threads,1
c++ container framework provides specialized classes,1
c++ container framework provides data storage,1
c++ container framework provides retrieval,1
language used for side scripting,0
language used for web browsers,0
javascript be run outside of the use,0
answer is expected for questions,0
an engine is included in mainstream web browsers,0
the mozilla developer network contains quality documentation,0
the mozilla developer network is also used in addition,0
the mozilla developer network is also used in environments,0
the language was officially called livescript,0
the language shipped in september,0
the language shipped in beta releases,0
the language was deployed in the netscape browser version 2.0b3,0
netscape adding support adding netscape adding support,0
netscape adding support adding netscape netscape netscape navigator 2.0 web browser,0
the final choice caused name caused confusion,0
the final choice giving the impression,0
the choice has been characterized as a marketing ploy,0
the term originated from netscape,0
ecmascript was developed as a standardization,0
ecmascript was developed as a standardization,0
people do not distinguish jscript variations,0
browsers implement the ecmascript 3 specification,0
the ecmascript 3 specification does not contain functions,0
javascript provide the potential,0
the dom provide the potential,0
malicious authors deliver scripts,0
browser authors contain this risk using two restrictions,0
scripts perform actions,0
scripts perform a sandbox,0
scripts are constrained by origin policy,0
access sent to another site,0
code is executed on a web page,0
this tag used in conjunction,0
java has level facilities,0
the jvm manages the help,0
the jvm see collection,0
java supports features,0
code executes on one platform,0
sun microsystems merged with oracle corporation,0
sun microsystems merged with january 27th,0
java was started as june,0
computing systems have installed tools,0
the java platform features a wide variety,0
developers work efficiently with the java programming language,0
the main reference implementation is supported by major companies including oracle,0
few computers can run java programs,0
java apps own installers,0
native code compiled to target version,0
java can be compiled java,0
java code need a java installer package supplier,0
a supplier will take care,0
java comes in lts,0
java comes in non-lts versions,0
suppliers release all versions,0
all versions will support lts versions,0
the end dates for available distribution,0
java programs should adhere to the following naming conventions,0
java programs decrease the chances,0
others understand code,0
people ask about the following java topics,0
applications need a programmable interface,0
python runs on the mac,0
a large standard library covers areas,0
the language comes with a large standard library,0
the python standard library get an idea,0
python allows programmers,0
python express concepts,0
